{
  "$schema": "https://json-schema.org/draft/2020-12/schema",
  "$id": "https://fullchaos.dev/contracts/auth/v1/jsonschema/acr-credential-lifecycle-event.v1.schema.json",
  "title": "ACR credential lifecycle event (v1 wire format)",
  "description": "One lifecycle event of an ACR client credential (fcacr_), as the Auth Control Plane receives it. ACR owns the credential: it generates the plaintext, keeps the hashed lookup and validates the data plane (ACP-ADR-08). The Auth Control Plane receives only this metadata projection, so the event is a closed description of lifecycle state and can carry no secret, verifier, token, token prefix or fingerprint: every member of the envelope, the payload and each change object is named here, additionalProperties is false at every level, and a test walks this schema and fails on any member name that suggests secret material.\n\nTHE IDEMPOTENCY KEY IS (aggregate_type, aggregate_id, revision), and `revision` is PER AGGREGATE (the aggregate is one credential, aggregate_id is the acr credential id, the registry's external_reference), never global. The `idempotency_key` must equal aggregate_type + \":\" + aggregate_id + \":\" + payload.revision, which the clients enforce. Consumer rule, the same as provisioning-event.v1: apply an event when its revision is exactly the last applied revision + 1 (or 1 for a credential never seen); a revision at or below the last applied one is a duplicate or stale delivery and is ignored; a larger one is a gap, which is not applied and means the consumer must resynchronise.\n\nLIFECYCLE. `issued`, `device_redeemed` and `rotated` open an aggregate and are revision 1. `device_redeemed` is a credential issued by redeeming a device authorization (acr class native_device or oauth_user). A rotation issues a NEW credential (its own aggregate) whose `rotated` event names the credential it replaces in `rotation_parent_id`. With no overlap acr also writes `revoked` for the replaced credential in the same transaction; with an overlap the replaced credential stays active and receives `expired` when its cut expires_at passes. `revoked` and `expired` are later events (revision 2 or more) and are terminal. A browser credential is never rotated. Scopes never change after issue: this contract has no scope or audience event, and a rotation never widens its parent, which the projection core enforces because a schema cannot compare two events.\n\nACTOR. `actor_type` (user, operator, credential, system) is acr's audit actor type. `actor_ref` names the actor, opaque to the Auth Control Plane, and is required unless the actor is the system, which has none. A credential acting on itself is actor_type credential: on `revoked` its actor_ref equals aggregate_id and on `rotated` it equals rotation_parent_id, which the clients enforce. `issued` and `device_redeemed` are never written by a credential actor (acr makes a credential from a credential only by rotating it). `expired` is always written by the system.\n\n`revision` is an integer token in 1..2^53-1; a decimal- or exponent-form token is refused by the clients on the raw token.",
  "type": "object",
  "additionalProperties": false,
  "required": [
    "schema_version",
    "aggregate_type",
    "aggregate_id",
    "event_type",
    "idempotency_key",
    "created_at",
    "payload"
  ],
  "properties": {
    "schema_version": {
      "const": "acr-credential-lifecycle-event.v1"
    },
    "aggregate_type": {
      "const": "acr_credential"
    },
    "aggregate_id": {
      "type": "string",
      "pattern": "^[A-Za-z0-9_-]{1,128}$",
      "description": "The credential's id in the ACR domain (the registry's external_reference)."
    },
    "event_type": {
      "enum": [
        "acr_credential.issued",
        "acr_credential.device_redeemed",
        "acr_credential.rotated",
        "acr_credential.revoked",
        "acr_credential.expired"
      ]
    },
    "idempotency_key": {
      "type": "string",
      "pattern": "^acr_credential:[A-Za-z0-9_-]{1,128}:[0-9]{1,16}$",
      "description": "Must equal aggregate_type:aggregate_id:payload.revision; the schema pins the shape and the clients enforce the equality (reject_by_client)."
    },
    "created_at": {
      "type": "string",
      "pattern": "^([0-9]{3}[1-9]|[0-9]{2}[1-9][0-9]|[0-9][1-9][0-9]{2}|[1-9][0-9]{3})-(0[1-9]|1[0-2])-(0[1-9]|[12][0-9]|3[01])T([01][0-9]|2[0-3]):[0-5][0-9]:[0-5][0-9](\\.[0-9]{1,6})?(Z|[+-](0[0-9]|1[0-9]|2[0-3]):[0-5][0-9])$",
      "description": "When the mutation committed. RFC 3339, every component bounded as in error.v1."
    },
    "payload": {
      "type": "object",
      "additionalProperties": false,
      "required": [
        "revision",
        "organization_id",
        "actor_type",
        "change"
      ],
      "properties": {
        "revision": {
          "type": "integer",
          "minimum": 1,
          "maximum": 9007199254740991
        },
        "organization_id": {
          "type": "string",
          "pattern": "^org_[A-Za-z0-9_-]{1,64}$",
          "description": "The tenant the credential belongs to, in the Auth Control Plane's form."
        },
        "actor_type": {
          "enum": [
            "user",
            "operator",
            "credential",
            "system"
          ]
        },
        "actor_ref": {
          "$ref": "#/$defs/opaqueId",
          "description": "The actor's acr-side id. Required unless actor_type is system, refused for system."
        },
        "request_id": {
          "type": "string",
          "pattern": "^req_[A-Za-z0-9_-]{26}$"
        },
        "change": {
          "type": "object"
        }
      },
      "allOf": [
        {
          "if": {
            "properties": {
              "actor_type": {
                "const": "system"
              }
            },
            "required": [
              "actor_type"
            ]
          },
          "then": {
            "not": {
              "properties": {
                "actor_ref": {}
              },
              "required": [
                "actor_ref"
              ]
            }
          },
          "else": {
            "properties": {
              "actor_ref": {}
            },
            "required": [
              "actor_ref"
            ]
          }
        }
      ]
    }
  },
  "allOf": [
    {
      "if": {
        "properties": {
          "event_type": {
            "const": "acr_credential.issued"
          }
        },
        "required": [
          "event_type"
        ]
      },
      "then": {
        "properties": {
          "event_type": {
            "const": "acr_credential.issued"
          },
          "payload": {
            "type": "object",
            "properties": {
              "change": {
                "type": "object",
                "additionalProperties": false,
                "required": [
                  "status",
                  "acr_class",
                  "scopes"
                ],
                "properties": {
                  "status": {
                    "const": "active"
                  },
                  "acr_class": {
                    "enum": [
                      "browser",
                      "oauth_user",
                      "native_device",
                      "org_bearer",
                      "operator",
                      "workload"
                    ],
                    "description": "The issuance class acr derived for the credential (acr client_class). A closed vocabulary of six."
                  },
                  "scopes": {
                    "$ref": "#/$defs/scopes"
                  },
                  "owner_subject": {
                    "$ref": "#/$defs/opaqueId",
                    "description": "The acr-side owner or approving subject, opaque to the Auth Control Plane. Absent for org_bearer, operator and workload credentials."
                  },
                  "expires_at": {
                    "$ref": "#/$defs/timestamp"
                  }
                }
              },
              "revision": {
                "const": 1
              },
              "actor_type": {
                "enum": [
                  "user",
                  "operator",
                  "system"
                ]
              }
            }
          }
        }
      }
    },
    {
      "if": {
        "properties": {
          "event_type": {
            "const": "acr_credential.device_redeemed"
          }
        },
        "required": [
          "event_type"
        ]
      },
      "then": {
        "properties": {
          "event_type": {
            "const": "acr_credential.device_redeemed"
          },
          "payload": {
            "type": "object",
            "properties": {
              "change": {
                "type": "object",
                "additionalProperties": false,
                "required": [
                  "status",
                  "acr_class",
                  "scopes"
                ],
                "properties": {
                  "status": {
                    "const": "active"
                  },
                  "acr_class": {
                    "enum": [
                      "native_device",
                      "oauth_user"
                    ],
                    "description": "The issuance class acr derived for the credential (acr client_class). A closed vocabulary of six."
                  },
                  "scopes": {
                    "$ref": "#/$defs/scopes"
                  },
                  "owner_subject": {
                    "$ref": "#/$defs/opaqueId",
                    "description": "The acr-side owner or approving subject, opaque to the Auth Control Plane. Absent for org_bearer, operator and workload credentials."
                  },
                  "expires_at": {
                    "$ref": "#/$defs/timestamp"
                  }
                }
              },
              "revision": {
                "const": 1
              },
              "actor_type": {
                "enum": [
                  "user",
                  "operator",
                  "system"
                ]
              }
            }
          }
        }
      }
    },
    {
      "if": {
        "properties": {
          "event_type": {
            "const": "acr_credential.rotated"
          }
        },
        "required": [
          "event_type"
        ]
      },
      "then": {
        "properties": {
          "event_type": {
            "const": "acr_credential.rotated"
          },
          "payload": {
            "type": "object",
            "properties": {
              "change": {
                "type": "object",
                "additionalProperties": false,
                "required": [
                  "status",
                  "acr_class",
                  "scopes",
                  "rotation_parent_id"
                ],
                "properties": {
                  "status": {
                    "const": "active"
                  },
                  "acr_class": {
                    "enum": [
                      "oauth_user",
                      "native_device",
                      "org_bearer",
                      "operator",
                      "workload"
                    ],
                    "description": "The issuance class acr derived for the credential (acr client_class). A closed vocabulary of six."
                  },
                  "scopes": {
                    "$ref": "#/$defs/scopes"
                  },
                  "owner_subject": {
                    "$ref": "#/$defs/opaqueId",
                    "description": "The acr-side owner or approving subject, opaque to the Auth Control Plane. Absent for org_bearer, operator and workload credentials."
                  },
                  "expires_at": {
                    "$ref": "#/$defs/timestamp"
                  },
                  "rotation_parent_id": {
                    "$ref": "#/$defs/opaqueId"
                  }
                }
              },
              "revision": {
                "const": 1
              }
            }
          }
        }
      }
    },
    {
      "if": {
        "properties": {
          "event_type": {
            "const": "acr_credential.revoked"
          }
        },
        "required": [
          "event_type"
        ]
      },
      "then": {
        "properties": {
          "event_type": {
            "const": "acr_credential.revoked"
          },
          "payload": {
            "type": "object",
            "properties": {
              "change": {
                "type": "object",
                "additionalProperties": false,
                "required": [
                  "status"
                ],
                "properties": {
                  "status": {
                    "const": "revoked"
                  }
                }
              },
              "revision": {
                "type": "integer",
                "minimum": 2
              }
            }
          }
        }
      }
    },
    {
      "if": {
        "properties": {
          "event_type": {
            "const": "acr_credential.expired"
          }
        },
        "required": [
          "event_type"
        ]
      },
      "then": {
        "properties": {
          "event_type": {
            "const": "acr_credential.expired"
          },
          "payload": {
            "type": "object",
            "properties": {
              "change": {
                "type": "object",
                "additionalProperties": false,
                "required": [
                  "status",
                  "expires_at"
                ],
                "properties": {
                  "status": {
                    "const": "expired"
                  },
                  "expires_at": {
                    "$ref": "#/$defs/timestamp"
                  }
                }
              },
              "revision": {
                "type": "integer",
                "minimum": 2
              },
              "actor_type": {
                "const": "system"
              }
            }
          }
        }
      }
    }
  ],
  "$defs": {
    "timestamp": {
      "type": "string",
      "pattern": "^([0-9]{3}[1-9]|[0-9]{2}[1-9][0-9]|[0-9][1-9][0-9]{2}|[1-9][0-9]{3})-(0[1-9]|1[0-2])-(0[1-9]|[12][0-9]|3[01])T([01][0-9]|2[0-3]):[0-5][0-9]:[0-5][0-9](\\.[0-9]{1,6})?(Z|[+-](0[0-9]|1[0-9]|2[0-3]):[0-5][0-9])$",
      "description": "RFC 3339, every component bounded as in error.v1."
    },
    "opaqueId": {
      "type": "string",
      "pattern": "^[A-Za-z0-9_-]{1,128}$",
      "description": "An opaque identifier of the acr domain: letters, digits, underscore, hyphen."
    },
    "scopes": {
      "type": "array",
      "minItems": 1,
      "maxItems": 64,
      "uniqueItems": true,
      "items": {
        "type": "string",
        "pattern": "^[a-z][a-z0-9_]*(:[a-z][a-z0-9_]*)+$",
        "maxLength": 64
      },
      "description": "Scope names, the shape credential_registry.scopes and principal.v1 carry. A set, at most 64. Never empty: a credential with no scope is not issued."
    }
  }
}
