{
  "schema_version": "acr-credential-lifecycle-event.v1",
  "aggregate_type": "acr_credential",
  "aggregate_id": "cred_exampleaaaaaaaa",
  "event_type": "acr_credential.issued",
  "idempotency_key": "acr_credential:cred_exampleaaaaaaaa:1",
  "created_at": "2026-10-23T10:00:00Z",
  "payload": {
    "revision": 1,
    "organization_id": "org_EXAMPLE0000000000000001",
    "actor_type": "user",
    "actor_ref": "subject_EXAMPLE0000000001",
    "change": {
      "status": "active",
      "acr_class": "browser",
      "scopes": [
        "context:read"
      ],
      "owner_subject": "subject_EXAMPLE0000000001",
      "expires_at": "2026-10-23T10:15:00Z"
    }
  }
}
