{
  "schema_version": "acr-credential-lifecycle-event.v1",
  "aggregate_type": "acr_credential",
  "aggregate_id": "cred_exampleaaaaaaaa",
  "event_type": "acr_credential.revoked",
  "idempotency_key": "acr_credential:cred_exampleaaaaaaaa:2",
  "created_at": "2026-10-23T10:00:00Z",
  "payload": {
    "revision": 2,
    "organization_id": "org_EXAMPLE0000000000000001",
    "actor_type": "system",
    "change": {
      "status": "revoked"
    }
  }
}
